date_received,product,sub_product,issue,sub_issue,consumer_complaint_narrative,consumer_complaint_narrative,company,state,zipcode,tags,consumer_consent_provided,submitted_via,date_sent_to_company,company_response_to_consumer,timely_response,consumer_disputed?,complaint_id
03/19/2015,Student loan,Non-federal student loan,Dealing with my lender or servicer,Keep getting calls about my loan,"I was behind on my loans, and I called about two months ago to get set up on a payment plan. They continue to harass and make threatening phone calls after I have made XXXX consecutive payments. I have asked them MULTIPLE times to stop calling and they always blame the issue on "" system error ''. I am at the end of my rope and I do n't know what else to do!! 
",,"Navient Solutions, Inc.",FL,331XX,,Consent provided,Web,03/19/2015,Closed with monetary relief,Yes,No,1291393
03/19/2015,Student loan,Non-federal student loan,Dealing with my lender or servicer,Trouble with how payments are handled,"My husband lost his job in XX/XX/XXXX and was unemployed for almost XXXX months. He has recently started a new job with XXXX and we are getting our finances back on track. However, by the end of XXXX, I struggled to keep up with the payments and my student loans became dangerously past due. On or around XX/XX/XXXX, I arranged a {$250.00} student loan payment on line. I did not realize until it was too late that I had forgotten to change my banking information and the payment was rejected by my bank. ( I have since cleared this up. ) I called AES to discuss further options. On XX/XX/XXXX, I was told by a representative that I qualified for XXXX-day forbearance. When we discussed the unfortunate payment error, she said, "" do n't worry about it ; the forbearance period would cover the non-payment. On XX/XX/XXXX, my credit bureau monitoring service notified me that my credit score had dropped by over XXXX points due to a XXXX-day late payment reported by AES. This was AFTER I was assured that I qualified for the forbearance. 

When I called AES to inquire about this, I was told that credit reporting operated on a separate system and that credit reporting was "" automatic, '' but that he would note the situation in my file. All of the representatives have been very pleasant and helpful. However, as I explained to XXXX of the representatives, I am a consumer. When a representative tells me "" not to worry about a payment issue, '' I listen. My husband and I are XXXX veterans and have to commute 2 hours to work every day. We are responsible and have not missed a student loan payment in several years. We need to buy a home closer to our work. 

The problem is this. The loans with AES are a consolidated debt of XXXX different loans. When the loans were reported to credit bureau as XXXX days late, my credit scores dropped almost XXXX points for EACH LOAN. That 's approximately XXXX points!!! This is neither fair nor accurate. When payments are made, amounts are applied to each individual loan. The way this is set up, even if XXXX of the XXXX loans is late, ALL XXXX report late. No credit report can sustain and instant XXXX point drop in credit score over something this confusing. 

Like I stated earlier, I am a veteran and a responsible citizen. I struggled to pay the loans on time for the entire XXXX months my husband was out of work. It is not fair that I should have to suffer the insult of a XXXX day late payment due to misinformation that I was given. If I am late making payments due to neglect, then I would feel like I have earned this discredit. However, I was acting on information supplied to me by a company representative. I followed their rules. Therefore, I respectfully ask that the XXXX day late be removed from all XXXX credit bureaus so that we can move on with our lives. 
",,AES/PHEAA,GA,300XX,Servicemember,Consent provided,Web,03/19/2015,Closed with explanation,Yes,No,1291407
03/19/2015,Credit card,,Other,,"I applied for a credit card and was accepted from usaa. they sent me a welcomepack and I recived a bill shortly after. I do all my banking online so I tried to pay the bill right away. they told me I could not hat they needed more information so I sent them morewas told that was good and I should get a reply within 2 to 3 business days never did get a reply so I contacted them again. they told me they needed more info so I sent them more and they told me that they would get back to me in 2 to 3 business days they never did. I got another bill in the mail plus emails on my computer called them up and they told me the last info I sent them was n't right so I explained what I sent them and was told that it would work and they would get back a hold of me in 2 to 3 business days and that I would be able to pay the bill at that time i waited to here back from them never did and contacted them again. they told me the info was not good enough and I had to send more information. I at this point told them to forget it and take me out of there system.they toldme okay and I would recive conformation in two to 3 buissness day in I never did after numorous calls and complaints I am still in there system they turned this into the credit agency during this whole process and it shows as a unpaid bill it has lowerd my credit score enough that ino longer qualify for the home loan i was getting I had a XXXX before all this its now down to a XXXX I needed a XXXX and every thing was fine. so I am stuck staying at a friends house because of a card that I never seen had or used and being forced into getting checks to pay them for something I do n't have they said the only way I can pay for this bill for a card I do n't have and never had is to get checks and mail it to them I am totally frustaited with this hole thing 
",Company believes it acted appropriately as authorized by contract or law,USAA Savings,AK,998XX,,Consent provided,Web,03/19/2015,Closed with non-monetary relief,Yes,No,1291408
03/19/2015,Bank account or service,Checking account,"Account opening, closing, or management",,"I signed up for a PNC account on XXXX XXXX 2014. The promotion was for {$200.00} if I had a direct deposit of at least 700 dollars and XXXX bill pays per month. I signed up for the bill pay and the direct deposit. Prior to signing up i called customer service a few time to confirm the promotion. I was told that I should be set up and the promotion should pay in XXXX. I followed up at the begining of this month only to learn from an associate that the account is set up on a promotion to receive a 200 dollar credit for a 2,000 dollar monthly direct deposit. That is not the information that I received on the promotion. Nor is it what i was it the information that I received from the customer service representatives that I talked to. I did everything that was asked of me, and they changed the rules. I spoke to a supervisor and she told me that she cant pull the phone calls because the conversation was too long ago, she asked that I provide the link that I received the promo offer for. Unfortunatly, I no longer have the link ... 5 months later it is hardly likely that I still have the link that I went to to sign up. Its unfair to trick me into getting an account that charges me 15 dollars per month and not receive what was promised to me. I just want the credit that was promised to me. 
",,PNC Bank N.A.,PA,191XX,,Consent provided,Web,03/19/2015,Closed with explanation,Yes,No,1291414
03/19/2015,Credit card,,Identity theft / Fraud / Embezzlement,,"I would like to be credited in full, of all the fraudcharges including, the charges for products andservices, they claimed they offered that I 'm notsure what they are. I did not apply for creditwith this company, or with any one that maybe associated with as a victim of fraud. 
I feel like I 'm being scammed agained. 
for these reason I do n't use credit card norapply for credit.i do n't feel safe. 
",,Capital One,NJ,070XX,,Consent provided,Web,03/25/2015,Closed with explanation,Yes,No,1292415
03/19/2015,Mortgage,FHA mortgage,"Loan servicing, payments, escrow account",,"My mortgage was bought by Green Tree in XXXX XXXX. My husband lost his job in XXXX XXXX and we got behind. We tried to work arrangements out with Green Tree. They are refusing my payment unless I bring it current. They are calling several times a day and faxing over personal info and payment history to my work fax and my co workers seen it. I paid a XXXX payment in XXXX $ 4200- because of there threats of taking my home. I paid another XXXX in XXXX and called another payment in for XXXX in XXXX. I was told I am still XXXX payment behind and needed to pay {$4200.00} for XXXX not XXXX and that would bring me current. I explained to them I do not have it. I then received another call a few minutes later from another account Rep - who handles my Account - I was threatened they would void my payment for that day and it would put me 60 days past due. I asked again to speak with a manager - who then gets on the phone and says they will look in to it. I called back the next day and asked if my payment had been voided, I was told no. I pulled my bank statement up and see they reversed it back into my bank account. How can they refuse a payment after excepting it. The tactics they use are not right for those who are trying to keep our homes. They are purposely refusing PAYMENT to damage my credit and make me loose my home. What can I do?? They told me to file foreclosure. I can not believe they would want to push a customer into foreclosure over being XXXX payment past due. I am trying to keep my home and have always paid on time until my husband lost his job. I have proof of them excepting the payment then voiding it. I believe they are playing games, I have talked to several people who claim to be managers who say they will look into it with no follow up. 
",,Ditech Financial LLC,FL,327XX,,Consent provided,Web,03/19/2015,Closed with explanation,Yes,No,1291420
03/19/2015,Debt collection,I do not know,Cont'd attempts collect debt not owed,Debt is not mine,"I have sent a letter to them regarding the matter. However, no one sent a response. Unfortunately, I was the victim of identity theft. I have done everything required of me by law to dispute the fraudulent items on my credit report. I sent a letter to "" AFS Acceptance, LLC. '' on XX/XX/2014 via USPS certified mail. The company refuses to honor my rights under the FDCPA & the FCRA as a victim of identity theft to remove the fraudulent inquiry that was submitted without my knowledge, consent and/or authorization. 

Please find attached the notice that was sent out along with the attached certified receipt. Information can be tracked online using referenced information. Thank you for you time and attention regarding the matter. 
",,"AFS Acceptance, LLC",MD,207XX,Servicemember,Consent provided,Web,04-03-2015,Closed with explanation,Yes,No,1292226
03/19/2015,Debt collection,Medical,Cont'd attempts collect debt not owed,Debt was paid,"I have paid all copays and just rec 'd a bill from a collection agency. I have never rec 'd anything in the mail before on this. I called the Dr offfice and they say it was because visits that are being billed didnt have a referral but I always had a referral and if they told me that I would have gotten XXXX. I have attached proof that my primary care physician did send referrals. I feel as though this is some sort of way for them to bill people almost 5 years later knowing they will pay or it will kill their credit. I am in the XXXX and will be forced to pay something that is not accurate almost 5 years after the services. 
",Company believes it acted appropriately as authorized by contract or law,"Capital Accounts, LLC",MA,027XX,,Consent provided,Web,03/25/2015,Closed with explanation,No,No,1291437
03/19/2015,Mortgage,Conventional fixed mortgage,"Loan modification,collection,foreclosure",,"TOO BIG TO FAIL AND CARE We are in our XXXX, after our last child went off to college in XX/XX/XXXX, we decided to downside and move into a smaller place. In XX/XX/XXXX, we paid down on our dream home. This is an XXXX and half bedroom condo in the heart of XXXX -- - ( no car needed ) XX/XX/XXXX, we were informed that BOA had sold their XXXX units to XXXX XXXX, an out of state acquisition company. A meeting was held on XX/XX/XXXX, by the new purchasers. At this meeting, we the few owners were informed that because they ( new owners ) were the majority stakeholders, they could do away with the condo Bylaws. Thus the Bylaws were amended and the new board appointed. 
We were told the following : Sell our units to the new owners at the same price which was given to them by BOA Continue to live in our unit -- -knowing that the building will no longer abide by the condo Bylaws, but instead will be operated and managed as an apartment complex. 
We were also informed that we will never be able to sell our unit on the open market because of the rental average of the building. 
Our condo was purchased in good faith. We 'd everything that was right under the law. The present situation we are in is no fault of ours. The housing market tanked, and BOA did what was best for them -- -sold their units to the highest bidder -- - NOT CARING ABOUT HOW THEIR DECISION WOULD AFFECT THEIR HONEST CUSTOMERS THAT PURCHASED AND HAVE MORTGAGES WITH THEM. -- -- TOO BIG TO CARE. The investors on the other hand needed to realize a profit quickly changed the Bylaws to protect their investment. Who cares about ordinary Americans like us no one? We are the casualty of the housing bubble. We could have walked away them this situation like many other American, but we did n't because we are honest FOOLS. 
",Company chooses not to provide a public response,Bank of America,GA,300XX,,Consent provided,Web,03/19/2015,Closed with explanation,Yes,Yes,1292055
03/19/2015,Mortgage,Conventional fixed mortgage,"Loan servicing, payments, escrow account",,"I live in California, my former mortgage holder, XXXX, went bankrupt and sold our loan to Green Tree. Prior to the sell, I had never heard of this company. As a result of the sell Green Tree opened an escrow account, to pay property taxes and insurance, I never had a escrow account before and do not believe the State of California requires lenders to maintain an escrow account. My mortgage is a fixed rate 30+ year mortgage and the monthly mortgage payment is {$1200.00} and I pay $ XXXX monthly to cover the escrow payment for property taxes and insurance. According to my monthly statement from Green Tree, my regular monthly payment is {$1500.00} so I pay roughly {$11.00} per month more than is required which I acknowledge was no designated to be applied to the escrow account until I recently made my XXXX payment. Despite my attempts to comply with the terms of this loan, every year since Green Tree has held our mortgage we get a bill for XXXX of dollars, this year it was {$800.00}, supposedly because of escrow shortages. Every year it 's a different amount, but the escrow shortages are always for XXXX of dollars and the amount of insurance and property taxes we pay annually does not increase that much to justify these increases of XXXX of dollars each year. Green Tree provides this annual escrow account disclosure statement with this convoluted calculation to justify these increases ( copy attached ). This year XXXX days prior to receiving the annual escrow account disclosure statement we received a letter from Green Tree stating that our account was current ( copy attached ). Each year I contact Green Tree to get someone to explain these calculations and I have yet to understand the justification or the explanation. If you do n't pay the amount of the shortage Green Tree threatens to increase the amount of your regular monthly payment to cover the shortage. I find it hard to believe it is legal for a mortgage company to charge a borrower XXXX of dollars more per year to maintain an escrow account if it 's cheaper for the borrower to pay their own property taxes and insurance. If the borrower 's property taxes and insurance are not delinquent, then a borrower should be able to opt out of such a onerous escrow arrangement. If Green Tree is able to charge people XXXX of dollars more each year for these "" supposed escrow shortages '' it 's no wonder they require borrowers to have an escrow account. We should be able to pay our own property taxes and insurance to avoid the financial hardship that Green Tree is creating. We are currently stuck with this mortgage company, but at the first opportunity we will make every effort to change lenders. But I do n't believe we should be penalized because we are stuck with this company. A company we did not voluntarily enter into a contract with. It should not be legal for a mortgage company to require consumers to have an escrow account that costs them hundreds of dollars more per year than it would cost if that consumer paid their own property taxes and insurance. I do n't know if this practice is legal but it should n't be and it definitely needs to be investigated. 
",,Ditech Financial LLC,CA,945XX,,Consent provided,Web,03/19/2015,Closed with explanation,Yes,No,1291489
03/19/2015,Mortgage,Conventional fixed mortgage,"Loan servicing, payments, escrow account",,"Ocwen loan servicing is the servicer of my loan. 
1. They refuse to talk to about anything. 
2. They refuse to send me any papers. 
3. They will not send me my statements4. They will not send payment statement. 
5. They will not return any letters or phone calls. 
6. They refuse to let me know what owed on loan. 
7. They refuse to let me know if they received my payments. 
8. They refuse to let me know what my payments are. 
9. They but forced insurance on this property when I have insurance on the property. They refused to take it off after 3 months of sending them proof and calling them over XXXX times. 
10. They double charged me for insurance. 
11. The only thing that they will say when I call, is that they were told not to talk or send anything to me due to I filed litigation against them. 
XXXX. I have over XXXX documented calls to Ocwen and copy 's of letters sent to prove this. 
I believe they are doing this because I filing a lawsuit and complaints against them in an unrelated mortgage that they are servicing for XXXX XXXX XXXX. ( Case, XXXX in XXXX County ). This has noting to do with this loan which is owned by you, XXXX. There is no reason for there conduct in the servicing of this loan. I have no complaints or lawsuits against you. I have not missed any mortgage payments. Its not in foreclosure. I want to make payments on time and have been making payments for the last 4 months not knowing what my payments are, and if they were even credited ect. 
I believe they are going to to try to foreclose on this loan even though I have proof of all of this, just like they illegally did on the loan with XXXX. This is the loan I filed the lawsuit on. This letter will be sent along with complaints to other agency 's including the press. 
The nation is in a foreclosure crisis and the courts are full of foreclosure cases. There is no excuse for this conduct by Ocwens loan servicing. They may cause this loan to go in foreclosure for no reason what so ever. 
",,Ocwen,FL,337XX,,Consent provided,Web,03/19/2015,Closed with explanation,Yes,Yes,1290421
03/19/2015,Debt collection,Payday loan,Taking/threatening an illegal action,Threatened arrest/jail if do not pay,"This debt collector has called me numerous times from a private number, contacts every single member of my family numerous times, and has called me at work. They even called my oldest daughters boyfriend, who has never been affiliated with me, on a phone number he just received 3 days ago. I have told them to not call me again, I do not owe this debt and the calls keep coming. They are now stating that they have a case against me and they want my home or work address so they can serve me papers. I want this to stop. 
",,"National Principal Group, LLC",FL,326XX,,Consent provided,Web,03/26/2015,Closed with explanation,Yes,No,1291526
03/19/2015,Credit card,,Credit determination,,"i recently closed and paid off my citizens bank credit card account ove one month ago. Today i received a call from them saying that my account was past due.now, they never sent me a letter in the mail saying that i owed them money after i have requested a payoff and paid the balance in full. they are attempting to report my account past due for 33 days with the credit reporting agencies. i have worked tirelessly to build my credit, and now Citizens bank wants to destroy over {$27.00} when they never had any type of notification in place to make me aware of the balance. 
",,"Citizens Financial Group, Inc.",MA,023XX,,Consent provided,Web,03/20/2015,Closed with explanation,Yes,No,1291547
03/19/2015,Mortgage,Conventional fixed mortgage,"Loan modification,collection,foreclosure",,"We started dealing with Citi Mortgage back in XX/XX/XXXX for a modification. During the process of approximately 14 months, of continuing to send them documents after documents. The same documents many times. Having approximatley XXXX different representatives helping us. With each time a change in representative, meant us sending again the same documents. Also, we found out that some had different answers than others. At the beginning of this process, we were told by Citi Mortgage that in order to be approved to continue to go on with the modification process, we had to be 4 months behind. If we are current that shows Citi Mortgage there is no need for a modification. So that is what we did. I will say that is the dumbest thing we did. Than we ended up to where out acct ended up in foreclosure status, and we could no longer make payments. After many, many months of frustration we contact XXXX XXXX XXXX to have them help us with the process. We started with them in XX/XX/XXXX. As of today, we are still working with them. XXXX XXXX XXXX representative tells me that Citi Mortgage continues to ask for documents. XXXX of many frustrating moments is with XXXX at Citi Mortgage. We have sent multiple times a letter stating in regards to some land we have. It was stated to her in detail that this land is a cash rent land. There is no mortgage on the land, it was in-heritated. It is split between my husband and his XXXX siblings. That the land is crop land only. We stated who farms it, the amount we receive. XXXX decided to determine we had a home on this property. Which delayed things again. There was never any indication of a XXXX home. If she would have read the answer to her question on this property, she should have known that it is crop land only. Is a field of weeds until the farmer puts the crop in. That we get a payment XXXX a year. not monthly as she was assuming. We have been served papers today by the attorney for Citi Mortgage, but yet they continue to call us daily. We do not speak to them as that is what XXXX XXXX XXXX is for. 
This process has taken way too long. Many of the documents that they keep asking for do not change. The only thing that changes slightly is our pay stubs and bank statements. We need help to get this finalized. 
",,Citibank,ND,587XX,,Consent provided,Web,03/19/2015,Closed with explanation,Yes,No,1292406
