date_received,product,sub_product,issue,sub_issue,consumer_complaint_narrative,consumer_complaint_narrative,company,state,zipcode,tags,consumer_consent_provided,submitted_via,date_sent_to_company,company_response_to_consumer,timely_response,consumer_disputed?,complaint_id
03/26/2015,Debt collection,Federal student loan,False statements or representation,Indicated committed crime not paying,"On Wednesday, XXXX XXXX 2015, a company called EOS-CCA called me referencing my student debts. They informed me if I did not enter into a "" XXXX '' as of the date listed above, I would be subject to having charges pressed against me, and that my interest rate due to the contract of the Federal Student Loan I signed at the time I was in school has now risen to 6.8 % DAILY. The amount they said I owed was {$3000.00} dollars above the actual amount. After fearing that I would not be able to make my student loan payments and would be XXXX, they directed me to a website ( XXXX ) where I can print a "" XXXX '' and send it back via e-mail. After feeling some relief that I would now be able to handle my student loans and would not be subject to face charges pressed against me, I did some research on the company only to find out they are a fraud. The phone number they called me from is XXXX, the extension number given to me was XXXX, and the "" account handler '' only gave me her name as "" XXXX ''. On the "" XXXX '' I submitted to them, I gave them personal information such as, date of birth, home address, phone number, family size and my social security number. 
",,"EOS Holdings, Inc.",NY,112XX,,Consent provided,Web,03/26/2015,Closed with explanation,Yes,No,1302129
03/20/2015,Credit card,,Other,,"I have disputed this XXXX times but discovercard must be in cahoots with XXXX gym. 
I joined the gym and signed a contract for the regular membership in XXXX. Then, last XXXX of XXXX I decided to get a personal trainer at this gym. I talked with them and they said a 3 month program was what I needed. So I completed the 3 months. ( Actually, my XXXX XXXX went up so I could n't finish and that 's another story - trainer was going to keep my unused sessions for later, when bp was better. I have texts about this. The texts also prove my point of not even KNOWING of any contract as I am asking the trainer about my sessions EXPIRING after XXXX months ) So in XXXX of XXXX I get my discovercard and it shows they charged ANOTHER {$300.00} for a fourth month! I went from the mailbox directly to the gym. This is when I was told I hadto cancel my trainer sessions at least 30 days prior to ending and since I did n't have 30 days until the NEXT billing date, I would be charged ANOTHER {$300.00}. I was confused as I thought I just got 3 months and that was it, unless I signed up for more so they offerrd to keep the sessions for when my bp returned to normal and when I returned to Florida in XXXX from an extended trip. So I went home and just could n't figure it out how I had n't known better, or "" known ''. Next day, I went back and had the girl behind the counter print me out my contract. Turns out I had XXXX. XXXX was the original that I had signed, and XXXX was for the trainer and it WASNT signed and I had n't seen it! That explained it! They had gotten sloppy. They 'd also lost anything about me, like my diet from my dietitian, the original pre-workout measurements, etc. 
So when I called Discover card, I was told that this would be taken care of no problem, since there was no signed contract. 
I also still have text messages with my personal trainer where I ask if I have to do anything like talk to the "" big shots '' to be sure they keep my unused sessions until my XXXX XXXX improves, which is after my 3 months expire. He should have told me they DONT EXPIRE and I need to CANCEL 30 DAYS OUT!. I do n't think he was trying to scam me though. I hope not. I think they messed up and wanted to get {$600.00} more, like they normally would. Maybe they did it on purpose, do n't know. I just know my credit company should have went my way with the dispute. Their evidence they showed in the dispute was the UNSIGNED CONTRACT!! I said that is MY EVIDENCE!! What kind of country is this if they can truly do this? I think Discover is just incompetent or in cahoots, as I said before. 
Please help me. I refuse to pay this but am afraid it will ruin my credit and I have always strived to be a good citizen. I must say I 'm disenchanted. How could this happen? Nothing means anything anymore. A blank contract is good enough? How could they be so ignorant or did something change with contracts I 'm not aware of??? Thank you for your help. 
",,Discover,FL,330XX,,Consent provided,Web,03/20/2015,Closed with explanation,Yes,No,1293450
03/20/2015,Mortgage,Conventional adjustable mortgage (ARM),"Loan servicing, payments, escrow account",,"After expiring all my options with the mortgage company, I am writing this letter to you for your help in this matter. I think mortgage company is not working in good faith and doing unethical practices. I fell behind on my mortgage in last few months and been trying to catch up and have been in constant touch with Nationstar customer service department along with loss and mitigation department. Last month, in XXXX 2015, I called Nationstar 's customer department and asked for the total payoff so I can payoff the loan, however due to financial hardships on my side I was not able to pay it off and asked for an extension. 
XX/XX/XXXX I called again and talked to a customer service rep and told them that I am going to pay off the past due amount or if they can send me the total pay off amount I will try to pay off the whole loan amount..Furthermore I asked them if my loan is still current and there is no legal action on it. I was assured by the rep, that there were no red flags on my account and it was not going into foreclosure and I am good to pay by XX/XX/XXXX. 
XX/XX/XXXX, I got a letter from the third party collection agency ( XXXX ) that my loan has been transferred to them and is under trustee 's sale. I called XXXX and was told that I need to call Nationstar for them to take their case back. 
I called Nationstar customer department again and was transferred to Loss and Mitigation department, I explained to them what I was told by their customer rep XX/XX/XXXX and was told by the customer rep that I was good to pay by XX/XX/XXXX without any legal action on my account., however they were very rude and refused to help me. Nationstar litigation department also told me they were charging me extra {$1100.00} plus {$400.00} late fees on top of third party 's collection fee. I tried to talk to various reps in that department to solve this issue however I was met over and over again with rude reps, refusing to help me, I even asked to talk to a supervisor and was refused first and then was put to his voice mail, his name XXXX, left him XXXX messages between XXXX XXXX XXXX, however no response. Few days before that, I asked their department to send me a copy of total payoff and they told me I will have it within XXXX hours, however I never got anything, I called again, and now I was told it will take 7 -10 days. I begged their department to send me that payoff and remove the legal charges because the longer I will wait for the payoff the more legal charges are getting accumulated. However again, they failed to help or address these issues and Oh my god they were rude. Today, XXXX/XXXX/15, i got the payoff details via email after calling bunch of different reps and getting different answers from each one of them. 
After expiring all my efforts to solve this matter with their customer service department and especially loss and litigation department, I am writing this letter to XXXX office for their help and to stop their unethical practices and charging me extra legal fees when I was clearly told by them that if I am paid by XX/XX/XXXX there will be no legal action taken on my account. I am reaching out for your help in this matter. I do understand that I am late in my payments and I am making a full effort to bring my account to the current status. To prove that I have worked in good faith with Nationstar to bring my account to current status I have put in several calls to Nationstar in last couple of months and kept them updated with progress on my side. 
I even told Nationstar that I accept late fees on my account since I was late in paying my payments however they need to remove the legal charges since I was told XX/XX/XXXX that My account has no red flags and I have till XX/XX/XXXX to pay it off. The legal charge third party is charging me is around {$630.00} and on top of it Nationstar is charging me {$1.00} 
",,Nationstar Mortgage,AZ,852XX,,Consent provided,Web,03/20/2015,Closed with explanation,Yes,No,1293460
03/26/2015,Credit reporting,,Incorrect information on credit report,Public record,"I have XXXX judgements against me. At the time of service I had medical insurance to cover me. Instead of my insurance being billed I was directly sued by the medical provider. I 've contacted the XXXX and XXXX XXXX about this matter & was given proof that I had insurance coverage at the time of of service. I sent a written letter to each credit bureau with a copy of proof of insurance at the time of service requesting they remove it immediately off my credit and they have yet to do so. Please help me because I 'm being denied credit cards home loans and renting a place because of these derogatory remark. 
",,Equifax,MD,212XX,,Consent provided,Web,03/26/2015,Closed with explanation,Yes,No,1302266
03/26/2015,Credit card,,Other,,"I sent the below letter to Bank of America for a resolution, which they denied. I believe their actions are unjust. 

I am writing you with a very heavy heart. I am extremely dishearten and dissatisfied with the level of insensitivity and lack of understanding and communications received from Bank of America 's representatives regarding my closed account, now "" charged off ''. I am requesting the charge off be reversed due to miscommunications and technicality. In XX/XX/XXXX, I spoke with a representative, who I notified that I was having hardship ( became unemployed ). She notified me that my account would be charged off on XX/XX/XXXX. Being XX/XX/XXXX was on a Saturday ( weekend ). I paid the bill on Monday, XX/XX/XXXX, which was paid the next business day, XX/XX/XXXX. I had no idea my account would be charged off on a weekend and neither was I explained this information in detailed. 

Additional information : I also was told that I had a cease and desist order on my account, which too was puzzling. I never requested a cease and desist and was never told such an order would be put on my account when requesting not to contacted via telephone. Today, XX/XX/XXXX, the represented mentioned that the cease and desist stopped all phone calls and correspondence, which I would have never agreed to. Requesting not to receive phone calls is totally different then not receiving mail. I never knew there was an issue until now, because I was still receiving my monthly statements. Therefore, I did n't get any reminder notice for the upcoming charge off or notice of the actual charge off or any notice pertaining to this cease and desist order that I did not consent to. 

I have had several hardships during the course of this account from being unemployment several times, XXXX, newborn ( a bundle of joy, nevertheless a financial adversity ), accepting a XXXX "" only '' XXXX position, which was insufficient, thus having to move in with my mother, then recently in XX/XX/XXXX, becoming unemployed again. Through it all, I did the best I could. Now, that I have almost completed my payment in full, it is quite unfair and disappointing to receive a charge-off on my account for a difference of XXXX days, of which XXXX were weekend days. Furthermore, I never receive any notification pertaining to this charge-off, due to the above mentioned unauthorized communications disconnect. I thought Bank of America was in the business of helping people and that Bank of America would much rather see me pay my bill and build up my credit vs. damage my credit with a derogatory "" charge-off ''. 

I am asking that you have compassion, thereby reversing the charge-off on the aforementioned account, in so doing allowing me to pay my outstanding balance in the amount of {$1200.00} without such a steep penalty. I really like Bank of America and hope to be a customer again, when my financial situation changes for the better. 

Thank you kindly for your consideration, time and immediate attention to this matter. Providing you require additional information, please feel free to contact me. 
",Company chooses not to provide a public response,Bank of America,NJ,072XX,,Consent provided,Web,03/26/2015,Closed with explanation,Yes,Yes,1302268
03/26/2015,Debt collection,Credit card,Communication tactics,Frequent or repeated calls,"This debt collector calls repeatedly, 2-4 times per day including both weekend days, sometimes leaving automated messages. I last answered a call from them on XXXX, during which I informed them up front that I was aware of the state of my account and did not know when I would be able to pay the bill ; I was pushed no fewer than XXXX times to agree that I would have it paid by a certain, arbitrary date so that the caller could leave a note on my account to that effect, which I would then be held to, despite my repeated insistence that I was not certain I could pay by that date. The caller eventually put the note on my account despite my protests. The repeated calls are intrusive and stressful. 
",,Synchrony Financial,IA,522XX,,Consent provided,Web,03/26/2015,Closed with non-monetary relief,Yes,No,1302275
03/26/2015,Consumer Loan,Vehicle loan,Taking out the loan or lease,,"Around XX/XX/XXXX, I purchased a brand new car ( XX/XX/XXXX XXXX Versa ) with a goal of having the car for five years or at least XXXX miles. XX/XX/XXXX, the car started giving me problems, after researching the problem there was a power train issue, which XXXX has an extended warranty for my make and model. After having the car for over a week, XXXX returned the car to me in the same condition. The next day, I returned to car to XXXX, they currently have the car running more test. In addition to not fixing the car, the car failed inspection and XXXX gave me a bill for {$1600.00} to fix the car to pass Maryland state inspection. XXXX ripped me off, I purchased a {$10000.00} car, paid {$30000.00} for the car, it has a balance of {$13000.00}, appraising for {$6000.00} with less than XXXX miles, a refurbished engine and I can not legally drive the car in the state of Maryland. 
On XX/XX/XXXX, I went to purchase a new car and was told that I would not be able to be financed because of the Versa having a balance of {$13000.00}. 
",,GM Financial,MD,207XX,,Consent provided,Web,05-01-2015,Closed with explanation,Yes,No,1302287
03/26/2015,Credit card,,Closing/Cancelling account,,"The complaint i am filing is against XXXX XXXX XXXX. They finance my Walmart card ( s ) and XXXX 's card ( s ) .Recently i was informed by XXXX that my XXXX XXXX cards were closed and that the Walmart credit limit on XXXX of my cards was reduced. The reason given for these changes was that they recently re-reviewed my credit report and the report showed delinquencies as well as late payments. I have none of these and I am not understanding where they have come up with this information. i am also wondering why and how they could pull a XXXX credit report without my permission. I am very disturbed by this since the changes have negatively effected my credit history. 
",,Synchrony Financial,NY,130XX,,Consent provided,Web,03/31/2015,Closed with explanation,Yes,No,1302289
03/26/2015,Student loan,Non-federal student loan,Dealing with my lender or servicer,Trouble with how payments are handled,"I attended XXXX Illinois University in XXXX, IL from XXXX. It was difficult for me to find a full time position after graduating and my loans went into forbearance. In those XXXX years of looking for a job I gained {$30000.00} in interest on my XXXX loans. Sallie Mae/Navient is currently charging me an entire paycheck as a monthly payment and have screwed up time and time again on taking out my monthly payments after signing up for automatic debt. I am currently attending school again, and have notified XXXX XXXX to expire my deferment because I want to continue to make payments. They have not done so and have screwed up my payments while accumulating more interest on my loans. I have called XXXX times to complain/understand what is happening and they continue to give me the same excuse, that my payment for the month is past the deadline in which they can take it out, so wait till next month. I would n't have to wait if they would have done their job in the XXXX place. I even have documentation that shows that they expired my deferment. All I get is a "" I understand '' "" We are sorry you feel that way ''. Something needs to change, I am sure I am not the only XXXX they are doing this to. It is sad that I am regretting getting my XXXX, if I never did I would n't have to deal with such a XXXX company. 
",,"Navient Solutions, Inc.",IL,600XX,,Consent provided,Web,03/30/2015,Closed with explanation,Yes,No,1302309
03/20/2015,Debt collection,I do not know,Disclosure verification of debt,Right to dispute notice not received,"Have XXXX on my account from this company never have had any info on what is for on my trans union report the number is XXXX and the second is XXXX do n't know what they are for we have had XXXX XXXX for years and the other says insurance and we have had XXXX for years so no clue and never been contacted about these or had any info 
",Company chooses not to provide a public response,"Southwest Credit Systems, L.P.",ME,046XX,,Consent provided,Web,03/20/2015,Closed,Yes,Yes,1294186
03/26/2015,Debt collection,"Other (i.e. phone, health club, etc.)",Communication tactics,Used obscene/profane/abusive language,"Was unaware of debt owed and no contact was attempted by the collection agency or the school. I found out when I received an email from my credit report monitoring company contacted me. 
",,ConServe,TX,775XX,Servicemember,Consent provided,Web,03/26/2015,Closed with explanation,Yes,No,1302329
03/20/2015,Bank account or service,Other bank product/service,"Account opening, closing, or management",,"I refinanced my home and chose to preserve my Home Equity Line of Credit with Bank of America. They advised we would need to process a subrogation agreement which would take XXXX business days. That fell within the close date of XXXX XXXX, 2015, so we proceeded to pay the fees and process the subrugation. Bank of America missed the deadline by several days resulting in my being charged over {$3500.00} in interest from the original mortgagee because we went well into XXXX before the refinance was completed. 
",Company chooses not to provide a public response,Bank of America,CA,941XX,,Consent provided,Web,03/23/2015,Closed with explanation,Yes,Yes,1293518
03/26/2015,Mortgage,VA mortgage,"Loan servicing, payments, escrow account",,"Stonegate Mortgage Servicing has been rude and abusive to my inquiry on escrow/tax refunds due to me. Said they would call me back but I have had to keep calling to inquire through this process. I was told only XXXX manager was in today and could not speak to me. This is a separate issue but they only have XXXX manager for the entire servicing office that can handle escalated matters? Sounds like they are understaffed to handle sensitive issues and escalated matters properly. So, they received a check of my returned funds back from XXXX, their vendor partner, on a double payment and deposited those funds on XXXX XXXX. I called back a week later and was told they were not processing my funds until sometime in XXXX? They can process funds in 1 day from their own vendor partner but it takes 18 days to return funds to a consumer? Why so long? This is unfair to me and other consumers. 
",Company believes it acted appropriately as authorized by contract or law,Stonegate Mortgage Corporation,OH,452XX,,Consent provided,Web,03/26/2015,Closed with explanation,Yes,No,1302334
03/26/2015,Mortgage,Conventional adjustable mortgage (ARM),"Loan modification,collection,foreclosure",,"I have lived in my home for 30 years and am in danger of losing it at auction due to the actions of my lender Caliber Loans. I have endured extraordinary hardship and have slowly rebuilt my life and situation. However, Caliber has refused to open a review of my current financial situation, has not assigned a case manager or dedicated contact and has told me the only options is to short sale or reinstate the loan in full, which is not possible. I do n't understand how they can refuse to even CONSIDER working with me or helping me or looking at my current financial situation, which has changed considerably since my last review. They received millions in bailout dollars, I thought they were supposed to look at my information and give me a chance. 

I refinanced into this loan in 2007. A little over a year later when my wife turned XXXX she decided to take off and go on the road as a XXXX, abandoning me and the kids. XXXX. There were long periods of unexplained absences and several months later I had divorce papers drafted. XXXX At that time I had been taking care of the kids and making the mortgage payment since she had deserted us six months earlier. However the police came and we went to court. I could not afford an Attorney and my wife was granted XXXX as well as control of the house. I was forced to leave the house and my kids and had to move into an apartment. My employer found out about the XXXX and I lost my job as well. I eventually found a job XXXX and had to XXXX in my spare time to sell it in order to keep myself fed. I obviously was not in a position to make the mortgage payment. 

During that time my wife never made the mortgage payment, and let the house, the lawn and the pool go. I started my own company doing right sizing -- I am brought in to save them money and have slowly built this up into a good income source. I fought the XXXX and was eventually able to get back into the house and was able to get wife out and divorce finalized. I tried to put my life back in order XXXX step at a time. I contacted XXXX to see what could be done and at XXXX point I was apparently offered an interest only modification. I found out about this after the fact, I did not see the paperwork until the offer had expired and I suspect that my ex wife who was still lurking around at that time had something to do with that. 

I have tried since then to re-engage with Caliber and have not made any progress. My business and income have continually increased and now my son who lives in the house is working as well and contributing his share. If Caliber were to actually take the time to review me for all retention options, something they are REQUIRED to do due to their acceptance of government bailout funds they would see that I fit into guidelines for assistance. Their continued refusal to even give me a seat at the negotiating table is outrageous. 
",,"Caliber Home Loans, Inc",FL,330XX,,Consent provided,Web,03/26/2015,Closed with explanation,Yes,No,1302360
03/26/2015,Consumer Loan,Installment loan,Problems when you are unable to pay,,"the company dollar loan center somewhere in XXXX XXXX s/d told me they reported to all XXXX credit bureaus. they misrepresented. they only report to trans union when I offered to pay off loan ( small ) they increased the interest 159 %. they are very cut throat and refuse to put me infront of their corp '' hd qtrs. I want to resolve the problem. also wrongful credit reporting to smear me 
",,"DLC, LLC",NV,891XX,,Consent provided,Web,03/31/2015,Closed with explanation,Yes,No,1303620
03/20/2015,Mortgage,Conventional fixed mortgage,Settlement process and costs,,"I have a XXXX loan. 80 % with XXXX and 20 % with green tree. To refinance my loan for a lower rate I am refinancing the 80 % ( XXXX ). Green tree has asked for authorization form to release information. I signed the form and resubmited it. Green Tree has since asked us to change the verbage XXXX times on the authorization to release information. When contacting Green Tree their representatives can not help us and have no idea what to do but will send a letter. Normal quick refinancing with no money out takes 3-4 weeks, I have been waiting for 4 months all because of Gree Tree. I have no idea how this company is still in buisness. I have had several other issues with Green Tree. I am now seeking out other loan options to buy out my existing loan with Green Tree so that I will no longer have to deal with their incompitence. 
",,Ditech Financial LLC,IL,610XX,,Consent provided,Web,03/20/2015,Closed with non-monetary relief,Yes,No,1293547
