date_received,product,sub_product,issue,sub_issue,consumer_complaint_narrative,consumer_complaint_narrative,company,state,zipcode,tags,consumer_consent_provided,submitted_via,date_sent_to_company,company_response_to_consumer,timely_response,consumer_disputed?,complaint_id
03/20/2015,Debt collection,I do not know,Communication tactics,Frequent or repeated calls,"Repeated calls being informed that they are trying to serve me some legal documents. Misrepresenting themselves and leaving threatening voicemails. Constant and frequent calls with none on the other end and ghost calls to relatives. Cease and desist emailed and faxed. I have XXXX XXXX and they are stressing myself and my XXXX year old mother. 
",Company believes complaint caused principally by actions of third party outside the control or direction of the company,"Advance America, Cash Advance Centers, Inc.",TX,774XX,,Consent provided,Web,04-03-2015,Closed with explanation,Yes,No,1292498
03/20/2015,Mortgage,FHA mortgage,"Loan servicing, payments, escrow account",,"My wife & I had a FHA backed XXXX yr mortage serviced by XXXX XXXX XXXX, signed in XXXX, XXXX. We filed for Chapter XXXX bankruptcy protection in XXXX XXXX, including our mortgage in the filing. All mortgage payments & arrearages were being serviced per our Trustee 's Agreement on time, & without prejudice, even as we attempted to refinance our mortgage to a much more advantageous rate. We finally found someone to do an FHA Streamline on our mortgage, when we were informed that XXXX XXXX XXXX filed an insurance claim in XXXX XXXX against our FHA MIP due to our loan "" being delinquent. '' Our mortgage was then "" picked up '' by Caliber Home Loans, whom we were informed would be our new loan servicer. We were also told we no longer had an FHA Loan, according to Caliber. We have no idea how we could be taken out of our FHA loan-preventing our Streamline Refinance- & put into some "" XXXX status '' as we were informed that our mortgage is now in. In addition, we are still paying FHA MIP payments in our mortgage payments on our mortgage since Caliber took over our mortgage, as well as we have yet to have our mortgage payments be reduced after a significant drop in our homeowners policy as well. 
",,"Caliber Home Loans, Inc",TN,372XX,,Consent provided,Web,03/20/2015,Closed with explanation,Yes,No,1292509
03/20/2015,Mortgage,Conventional fixed mortgage,"Loan servicing, payments, escrow account",,"Hello, I am a veteran from the XXXX XXXX, and I am unemployed at this time because of my injuries from the military and other XXXX issues. My mortage holder forclosed on my loan because of accounting errors on their part and applied forced insurance amounts to my account statements and spread sheets when we already have our home insured thru State farm insurance agency. We would make payments to the mortage company and they would in term send our payments back or would deny that they receive them at all. We are doing the best that we can with making our payments on time but it is very hard to do with our lender threating us with forclosure notices. We have been back a forward with them trying to resolve serious issues with them we have not came to a favorable conclusing at this time. We think that our mortgage company has fail to follow appropriate billing and accounting practices with our homeowners loan. 
",,Ditech Financial LLC,AL,367XX,Servicemember,Consent provided,Web,03/20/2015,Closed with explanation,Yes,Yes,1292713
03/20/2015,Debt collection,I do not know,False statements or representation,Attempted to collect wrong amount,"an amount on my credit report which is not in my name nor have I had a history with this company 
",,"Pinnacle Recovery, Inc.",ME,040XX,,Consent provided,Web,04-06-2015,Closed with explanation,Yes,No,1292717
03/20/2015,Student loan,Non-federal student loan,Dealing with my lender or servicer,Trouble with how payments are handled,"XXXX XXXX and XXXX had XXXX loans with XXXX XXXX, when they split into the Navient they screw up my payments, would send XXXX to Navient and XXXX to XXXX XXXX, per the addresses they provide me. Well all the payments I sent to Navient were getting credited to the XXXX XXXX XXXX account. I called them and they said I had to send them proof that I sent the money, and to up-load the cancelled checks. Went online to upload documents as they told me to, but there are no options to upload the docs on their website. Called again, had to explain the story XXXX or XXXX more times to different reps. They kept on passing the buck around to different reps. 
Finally a rep told me there was no place to upload docs as the other reps told me to do ... ... Straight up lies. Finally talked to a rep, who told me to send separate payments to different account numbers, XXXX to Navient and XXXX to XXXX XXXX. These companies should be shut down. Customer service is on par to XXXX. XXXX different companies under XXXX umbrella. 
",,"Navient Solutions, Inc.",NY,131XX,,Consent provided,Web,03/25/2015,Closed with explanation,Yes,Yes,1292738
03/20/2015,Bank account or service,Checking account,"Account opening, closing, or management",,"Hello, I use to have an account with Capital One and XXXX ( also Capital One ), the bank cancelled my account without explanation and few month 's later XXXX canceled my account, again there was no explanation. I was a good costumer at the Bank and doing small but growing investment with XXXX XXXX. 
Best regards, XXXX XXXX 
",,Capital One,MD,208XX,,Consent provided,Web,03/20/2015,Closed with non-monetary relief,Yes,No,1292837
03/20/2015,Mortgage,Conventional fixed mortgage,Settlement process and costs,,"XXXX / Citizens Bank, N.A. adds fees for additional insurance to my mortgage year after year. Year after year I 've requested the additional insurance removed, completed all required forms and submitted all requested information. I had been advised the insurance would be removed when calling after confirming I met all their requirements in prior years, but the insurance was not removed. This year a law firm has become involved, I 've made XXXX attempts to submit the forms, only to be told today that the address that Citizens Bank provided was incorrect. I am now being asked to complete and resubmit forms a XXXX time. The additional cost of the insurance is significant each year, and with the FEMA flood insurance increases in addition to our own personal home owners insurance that is required seems excessive. Each year I have gone through this process of sending forms after forms, then call after call I usually get told it will be removed, but never has been. I do n't feel that their practices are appropriate, their process is nearly impossible especially for someone working full-time and I feel their information is deceptive. This additional insurance requirement was added later after loan origination, disclosures sent, but again obviously they do n't want to enable a consumer to remove or reduce this added insurance no matter how much additional coverage the homeowner has on the personal policy. 
",,"Citizens Financial Group, Inc.",NY,144XX,,Consent provided,Web,03/26/2015,Closed with explanation,Yes,No,1292855
03/20/2015,Mortgage,Other mortgage,Settlement process and costs,,"Caliber Home Loans does not have a Single Point of Contact on any file. Ever. They refer you to a "" SPOC Dept ''. You can NEVER get out of their prompt system. They provided a modification agreement without a term and maturity date. 
",,"Caliber Home Loans, Inc",RI,028XX,,Consent provided,Web,03/26/2015,Closed with explanation,Yes,Yes,1294207
03/20/2015,Credit reporting,,Credit monitoring or identity protection,Problem cancelling or closing account,"Transunion conceals customer service hotline on company website. I had to go to a consumer info sharing site to get the number. I am convinced the number does not appear at all on their own site. 
",,"TransUnion Intermediate Holdings, Inc.",OR,972XX,,Consent provided,Web,03/20/2015,Closed with explanation,Yes,No,1292866
03/20/2015,Debt collection,Credit card,Cont'd attempts collect debt not owed,Debt is not mine,"I wish I could click more than XXXX item above that is an issue, instead I will list them here. 
Asset Recovery, they call under both names, continuously harrasses me on my cell phone and now they have started to contact me at work. Even going so far as to misrepresent themselves as contacting me on behalf of my employer ( while I was at work ) and asking me to confirm my ss # etc. They then laughed when I would n't and said I would most likely be fired. 

They are trying to collect on a debt I DO NOT OWE. My credit is clean. I do not owe XXXX. I contacted XXXX XXXX Services and they said they have no idea what XXXX or Asset Recovery are speaking of. My account is up to date and paid adn has been. 

XXXX/Asset is also saying that there is a lawsuit against me and they are going to inform my employer and I will be fired. I have been cursed at, yelled at and threatened day and night. It 's not stopping and now it 's at my place of my employment when I 've asked them to stop. 

This is a horrible horrible business and it seems there is no recourse. 
",,"Asset Recovery Solutions, LLC",NJ,070XX,,Consent provided,Web,08/24/2015,Closed with explanation,Yes,No,1292474
03/20/2015,Mortgage,FHA mortgage,"Loan modification,collection,foreclosure",,"Bank of America has endorsed and erected an "" intangible '' system and culture that takes advantage of the FHA program and its borrowers. My experience with Bank of America proved that this was the case and that they were not concerned with what was in my best interest. I did all that I could within my knowledge, diligence, persistence, and power for a favorable outcome on my behalf. The crux of my grievance originates from both my XXXX hard work and expertise in finding Buyers for my property seemingly all for naught. In the beginning of my short sale request, my XXXX Realtor/Broker was able to find a buyer with cash ( proof of financials and legitimate documentation ) which was given to Bank of America during the application process. My XXXX Realtor/Broker informed me that all documents were administered in the "" XXXX System '', but was having difficulty finding them. Neither my Realtor/Broker nor I was informed by Bank of America ( in XXXX through XXXX XX/XX/XXXX ) that changes being made in the XXXX System would hinder the process until after the fact. Because of this, the documentation failed to be processed and I received a decline. Unfortunately, due to my Realtor/Broker 's Mother untimely passing, I elected to switch Brokers. My XXXX Broker found a Buyer right away ( as did my XXXX Broker ) who offered cash ( with all the appropriate proof of financials, authorizations, and documentation ) that offered approximately {$20000.00} more than the first offer. My second XXXX experienced the same Bank of America improprieties and challenges as my first XXXX ( i.e. not being updated by bank officials concerning the status of my short sale request ). My XXXX Broker received XXXX Declinations Letters while working on my behalf. Miscommunication or the lack of communication on the part of Bank of America since the onset of my short sale request, ; lack of continuity and/or inconsistency with bank negotiators managing my file ( where I and my Brokers were rarely able to speak with the same negotiator who was familiar with my case ), ; failure to provide informed updates to my Brokers and me as to the status of my case, ; mishandling of documentation through the "" XXXX '' system and in general by Bank of America, ; and lack of knowledge about the "" XXXX '' system ( which is supposedly the quickest and most effective apparatus in expediting documents of Bank of America short sale professionals ) was customary. I requested the short sale be initiated or reopened at least XXXX times by Bank of America 's Escalation Team, a XXXX XXXX HUD XXXX, and by Bank of America 's Office of The President. I had to go through the cancellation of my modification which took a considerable amount of time because Bank of America short sale professionals did not understand the "" full '' protocols and codes of the modification to short sale process. The preceding Declination Letters stated ... "" I failed to provide the documentation '' without any clear explanation as to what documentation was missing or needed. I had to fax documents to Bank of America 's short sale negotiator via Bank of America Branch in XXXX, Virginia. The Branch professionals notarized and spoke with the negotiator as to what was needed to expedite the process. However, at the application deadline, the negotiator stated that she never received the documents. My XXXX request for short sale was on XXXX XXXX, XX/XX/XXXX. The foreclosure of my home took effect in XXXX XXXX, XX/XX/XXXX. 
",Company chooses not to provide a public response,Bank of America,NJ,080XX,,Consent provided,Web,03/20/2015,Closed with explanation,Yes,No,1292898
03/20/2015,Mortgage,Conventional adjustable mortgage (ARM),"Loan modification,collection,foreclosure",,"My wife was laid off on XXXX XXXX, XXXX. Modification request was completed on XXXX XXXX, XXXX. XXXX XXXX XXXX stated, "" We 're unable to complete the review if we are missing documentation, so we may request updated financial information. '' What information did Wells Fargo use to make your final decision if you were missing financial information? This decision was made in XXXX business days from the time my wife was laid off her job. Why was n't the decision based on information provided repeatedly through congressman XXXX office, Faxes from branch Well Fargo offices in XXXX? How can you calculate 42 % of 0.0 income? Why did it take Wells Fargo XXXX business days to make a final decision when you found out my wife was laid off XXXX XXXX XXXX? 

XXXX XXXX XXXX of Wells Fargo stated, "" A review for HAMP Tier II was also completed and we were unable to approve you for a modification because the documentation provided at the time indicated that the modified payment would be more than 42 % of your monthly income. '' On XXXX/XXXX/XXXX XXXX XXXX XXXX of Wells Fargo stated, "" Based on the documentation you provided us, your proposed monthly modified payment would be more than 42 % of your monthly income. We reached this decision by reviewing your monthly income, which is calculated as {$0.00}. '' Based on this information, why did Wells Fargo based final decision on information provided on XXXX XXXX, XXXX? 

Questions we would like Wells Fargo to answer:1. Why Wells Fargo base final decision on information provided on XXXX XXXX, XXXX? 
2. Why was n't the decision based on information provided repeatedly through congressman XXXX office, Faxes from branch Well Fargo offices in XXXX? 
3. How can you calculate 42 % of 0.0 income? 
4. Why did it take Wells Fargo only XXXX business days to make a final decision when you found out my wife was laid off XXXX XXXX XXXX? 
5. How many home owners have been given HAMP Tier II in or around XXXX XXXX, CA which is where we live? 
6. Can we have a HAMP Tier II ASAP or by XXXX XXXX, XXXX because our house will be Trustee sold on XXXX XXXX, XXXX? 
",,Wells Fargo & Company,CA,945XX,,Consent provided,Web,03/20/2015,Closed with explanation,Yes,No,1292529
03/20/2015,Debt collection,Credit card,Cont'd attempts collect debt not owed,Debt was paid,"The debt, XXXX account was settled and paid with a collection Agency, in XX/XX/XXXX and XX/XX/XXXX, with confirmation numbers and check numbers. I have sent this information to another agency who is trying to collect on the debt, each time I call to verify it 's been taken care of and collection attempts to stop, I keep getting information that is incorrect. The original debt collection agency was XXXX XXXX. I was told on more than XXXX occasion that they could not give me any information because it was archived and they gave me other phone numbers to call. XXXX was the original credit card company and when I called their number the recording stated that they were not taking calls at this time. This was on a Thursday, before XXXX CST. Finally I was able to get in touch with their dispute department, via internet and email, I did get a response that the debt was paid in full along with the account number. I am still having issues with the NEW Collection Firm. 
",,"Portfolio Recovery Associates, Inc.",TX,758XX,,Consent provided,Web,03/20/2015,Closed with non-monetary relief,Yes,No,1292903
03/20/2015,Credit card,,Customer service / Customer relations,,"I have XXXX credit cards with Capital One. I had some financial difficulties and got a couple of months behind on all XXXX cards. 
I called Capital One to make arrangements on XXXX of the cards to pay {$60.00} over XXXX months to get caught up and gave them my bank account info to take the money out automatically. 
XXXX the other XXXX cards, I was able to pay them off in full. I called in to Capital One and made the payments over the phone. 
A few days later, I went online to check that the accounts reflected the new balance and found that each XXXX had a note that say the accounts had been suspended. 
I called in to Capital One to ask what this meant and they said that I could no longer use the accounts but they would remain open and I would still get a yearly charge for them but I could not use them again. 
They did not inform me when they took my money, nearly {$1000.00}, that I would not be able to use the cards anymore. 
Also, when I checked my credit, they reported me for being 120 days late which I was not, and never updated my balances to zero. They are still reporting the old balances. 
",,Capital One,TX,760XX,,Consent provided,Web,03/20/2015,Closed with explanation,Yes,No,1292579
03/20/2015,Consumer Loan,Vehicle loan,Managing the loan or lease,,"Bank XXXX XXXX sent the payoff on XXXX trucks to Blvd Bank, XXXX XXXX Loan Operations Department, on XX/XX/XXXXThe Cashier 's Check was cashed on XX/XX/XXXXBank of XXXX nor I received a lien release on my XX/XX/XXXX Chevy XXXX. When inquiry was made to XXXX XXXX Loan Operations area, they stated they are waiting for the file??? 
This truck was paid off XXXX days ago with a Cashier 's Check. There is no reason the lien release should not be sent out. I do not understand a bank operations area that can be that dysfunctional. This is totally unacceptable financial practice for a financial institution. Where is the fiscal responsibility? 
",,Scottrade Bank,MO,633XX,,Consent provided,Web,03/26/2015,Closed with explanation,Yes,No,1292528
03/20/2015,Money transfers,Domestic (US) money transfer,Fraud or scam,,"I was scammed into sending money for a XXXX bonus winnings randomly selected and the number they use is XXXX XXXX XXXX XXXX XXXX, New York XXXX and the phone number is ( XXXX ) XXXX 
",,MoneyGram,MO,658XX,,Consent provided,Web,03/26/2015,Closed with explanation,Yes,Yes,1292962
03/20/2015,Mortgage,Conventional adjustable mortgage (ARM),"Loan modification,collection,foreclosure",,"COMPLAINT1. XXXX XXXX ( "" Complainant '' ) has a completed a loss mitigation application with Wells Fargo Home Mortgage ( "" Wells Fargo '' ) and receipt of said application has been acknowledged by Wells Fargo in correspondence dated, XX/XX/XXXX. Exhibit XXXX. 
2. Complainant sent correspondence dated XX/XX/XXXX to Wells Fargo seeking specific answers that Wells Fargo failed and/or refused to answer in previous Qualified Written Request ( "" QWR '' ) and correspondence addressing violation ( s ) of "" Dual Tracking '' while an active and completed Loss Mitigation Application is being processed. Exhibit XXXX. 
3. In separate correspondence from XXXX XXXX XXXX, XXXX. ( "" XXXX '' XXXX, of XXXX, Massachusetts, XXXX has stated that the foreclosure on the property is suspended and that no sale date has been set. 
4. Correspondence sent to XXXX by the Complainant, dated XX/XX/XXXX, also addresses the specific issue of litigation while acknowledged and active loss mitigation is being accomplished. Exhibit XXXX. 
5. Correspondence from Wells Fargo also confirms that there is no active foreclosure and that no sale date has been set. 
6. Furthermore, in a phone conversation on XX/XX/XXXX with XXXX XXXX, Representative in Wells Fargo 's Customer Care and Recovery Group it was conveyed to the Complainant including but not limited to the fact that, "" Foreclosure is not active and that they are not actively seeking a sale date ''. 
7. In the same aforementioned phone conversation, Complainant requested clarification and reason ( s ) why a judicial action involving the Complainant to seek Declaratory Relief to publish foreclosure notices was active despite the completed loss mitigation application. 
8. Complainant, further asked for clarification and reason ( s ) why the petition for declaratory relief did n't violate "" Dual Tracking '' as defined pursuant to 12 CFR 1024.41, et seq., The National Mortgage Settlement Consent Order ( s ), Consumer Financial Protection Rule, Rule X, Office of the Comptroller of the Currency ( "" OCC '' ) Consent Orders, and other applicable statues and orders. 
9. XXXX XXXX was unable to address the specifics or the reason ( s ) as to the petition for declaratory relief to publish foreclosure notice ( s ), and was unaware of such action, except to repeat that no foreclosure action is being initiated against the Complainant. 
10. Furthermore, XXXX queried XXXX XXXX in same phone conversation as to the reason ( s ) for a guardian ad litem ( "" GAL '' ) and what party was paying the legal fees for the GAL, in the action to seek declaratory relief against the Complainant. 
11. Furthermore, XXXX XXXX indicated in his four years in the office at Wells Fargo he had never dealt with a client that was involved with a GAL in a foreclosure proceeding. 
12. Despite the active loss mitigation application, the action to seek a declaratory judgment to publish foreclosure notice ( s ) continues to the detriment of the Complainant and others. 
13. Complainant is forced to continue to expend, resources including substantial time and money defending a separate action which seeks to set dates and publish foreclosure notices while a completed and acknowledged loss mitigation application is being considered in violation of Dual Tracking. 
RELIEF SOUGHT14. Complainant seeks assistance to end the practice of Dual Tracking, which involved and is not limited to the petition for declaratory judgment to publish foreclosure notice ( s ) and date ( s ) for foreclosure on the subject property. 
15. Furthermore, Complainant seeks assistance in requiring Wells Fargo to answer questions in recently sent QWRs completely or give specific reason ( s ) why such question will not be answered. 
",,Wells Fargo & Company,NH,038XX,,Consent provided,Web,03/26/2015,Closed with explanation,Yes,No,1292998
03/20/2015,Debt collection,"Other (i.e. phone, health club, etc.)",False statements or representation,Attempted to collect wrong amount,"This isnt my debt 
",,Nationstar Mortgage,TX,770XX,,Consent provided,Web,03/26/2015,Closed with explanation,Yes,No,1293006
03/20/2015,Bank account or service,Checking account,Deposits and withdrawals,,"US Bank had XXXX accounts under my name and I thought you could write a check for XXXX account to deposit it into the other account, because XXXX account I thought had overdraft protection. XXXX disagreed with me and said that I was XXXX XXXX '' checks. I 'm XXXX and I feel she reported me to Chex Systems for a poor reason, granted that I was confused and had no idea this was n't allowed. She took advantage of my XXXX. 
",Company chooses not to provide a public response,U.S. Bancorp,IL,606XX,,Consent provided,Web,03/20/2015,Closed with non-monetary relief,No,No,1293023
03/20/2015,Credit reporting,,Incorrect information on credit report,Information is not mine,"Equifax refuses to remove erroneous information from my credit report. They said I can put a statement. But whats so funny is the company reporting the information XXXX, XXXX is out of business and they refuse to give me their phone number. 
",,Equifax,VA,234XX,,Consent provided,Web,03/20/2015,Closed with non-monetary relief,Yes,No,1294283
03/20/2015,Debt collection,Credit card,Cont'd attempts collect debt not owed,Debt is not mine,"I have NEVER had a credit card with XXXX XXXX XXXX. This debt is being shopped around to several collection agencies dumb enough to buy it. This is NOT my debt and I will NOT be paying it. 
",,Resurgent Capital Services L.P.,IN,463XX,,Consent provided,Web,03/20/2015,Closed with explanation,Yes,Yes,1294214
03/20/2015,Debt collection,"Other (i.e. phone, health club, etc.)",Communication tactics,Used obscene/profane/abusive language,"I have successfully contact the debt collector to arrange my file but i was told that they could not provide me with the information. i was asking to find out what is it that they are charging me for ( invoices, letter, etc ). They did not provide the information for my inquiry. 
",,"National Credit Systems,Inc.",FL,328XX,,Consent provided,Web,03/20/2015,Closed with explanation,No,Yes,1293062
